{
    "$schema": "../form-schema.json",
    "id": "2020",
    "icon": "plug",
    "name": "2020 Infinite Recharge",
    "hidden": true,
    "description": "Click here to open scouting form",
    "items": [
        {
            "type": "number",
            "label": "The Team / Robot Number",
            "exportLabel": "Team Number"
        },
        {
            "type": "header",
            "label": "Autonomus Period"
        },
        {
            "type": "counter",
            "label": "How many level 1 balls were scored during the autonomous period",
            "exportLabel": "Level 1 balls during autonomous"
        },
        {
            "type": "counter",
            "label": "How many level 2 balls were scored during the autonomous period",
            "exportLabel": "Level 2 balls during autonomous"
        },
        {
            "type": "counter",
            "label": "How many level 3 balls were scored during the autonomous period",
            "exportLabel": "Level 3 balls during autonomous"
        },
        {
            "type": "header",
            "label": "Teleop Period"
        },
        {
            "type": "counter",
            "label": "How many level 1 balls were scored",
            "exportLabel": "Level 1 balls during teleop"
        },
        {
            "type": "counter",
            "label": "How many level 2 balls were scored",
            "exportLabel": "Level 2 balls during teleop"
        },
        {
            "type": "counter",
            "label": "How many level 3 balls were scored",
            "exportLabel": "Level 3 balls during teleop"
        },
        {
            "type": "boolean",
            "label": "Does the robot go through the trench",
            "exportLabel": "Lowbot"
        },
        {
            "type": "boolean",
            "label": "Does the robot spin the control panel",
            "exportLabel": "Control panel"
        },
        {
            "type": "number",
            "label": "Driver rating",
            "helperText": "How good are the drivers, 1 being the worst (jerky, slow to respond, always in the way), 10 being the best (smooth, aware of the field, can avoid defense)",
            "exportLabel": "Driving"
        },
        {
            "type": "header",
            "label": "End Game"
        },
        {
            "type": "radio",
            "label": "How does the robot climb",
            "options": ["It was not in the climb area", "It was on the floor of the climb area", "It climbed onto the bar when it was level", "It climbed onto the bar when it was angled"],
            "exportLabel": "Climb"
        },
        {
            "type": "boolean",
            "label": "Was the climb bar balanced at the end of the game",
            "exportLabel": "Balanced climb bar"
        },
        {
            "type": "text-area",
            "label": "Other notes.",
            "helperText": "Anything else the robot did or has. Can it lift multiple robots? Did it defend well? Was the transition from Autonomus to Teleop fast?",
            "exportLabel": "Notes"
        }
    ]
}
